,created,favorites,hashtags,id,is_retweet,reply_id,reply_screen_name,retweeted_created,retweeted_screen_name,retweeted_source,retweets,screen_name,source,text,user_mentions,timestamp,date,weekday,hour
625,2016-10-17 12:22:44+00:00,4,,787992239075127296,False,,,False,False,,3,MarkKennedyUND,Twitter Web Client,- @MyUND at the cutting edge of UAS education - North Dakota students learn how to build drone businesses |  https://t.co/wPV3D6GKsR,myUND,2016-10-17 12:22:44+00:00,2016-10-17,0,12
626,2016-10-16 12:05:43+00:00,3,,787625568896421888,False,,,False,False,,0,MarkKennedyUND,Twitter Web Client,The future of @MyUND is indeed bright! - OUR OPINION: UND's bright future https://t.co/GKdb3C1les,myUND,2016-10-16 12:05:43+00:00,2016-10-16,6,12
627,2016-10-16 11:34:33+00:00,1,,787617725657051137,False,,,False,False,,1,MarkKennedyUND,Twitter Web Client,Looking forward 2 @MyUND alums continuing 2 open new frontiers - UND PRESIDENT MARK KENNEDY:  'New Frontiers' at UND https://t.co/AZzyYh0woA,myUND,2016-10-16 11:34:33+00:00,2016-10-16,6,11
628,2016-10-15 19:39:07+00:00,2,,787377280213397504,False,,,False,False,,0,MarkKennedyUND,Instagram,One of @undfootball biggest fans - Leon Osborne! Go @myUND 100th Homecoming. @ Alerus Center https://t.co/gdtgs3U1q6,UNDfootball; myUND,2016-10-15 19:39:07+00:00,2016-10-15,5,19
629,2016-10-15 14:54:04+00:00,5,,787305544981721088,False,,,False,False,,0,MarkKennedyUND,Instagram,All set for @myUND Homecoming parade. @ Gorecki Alumni Center https://t.co/ihnHQ7LSru,myUND,2016-10-15 14:54:04+00:00,2016-10-15,5,14
630,2016-10-14 22:19:20+00:00,2,,787055215027494912,False,,,False,False,,0,MarkKennedyUND,Twitter Web Client,Great to see @MyUND Prof Pablo de León in @NatGeo -Mars: Inside High-Risk Race to the Red Planet https://t.co/5mLhY3fonb via @NatGeo,myUND; NatGeo; NatGeo,2016-10-14 22:19:20+00:00,2016-10-14,4,22
631,2016-10-14 22:03:20+00:00,0,,787051188990586881,False,,,False,False,,0,MarkKennedyUND,Twitter Web Client,I am honored to be the 2nd President Kennedy to speak at @MyUND - Camelot on campus https://t.co/XEVqxWZQ6u,myUND,2016-10-14 22:03:20+00:00,2016-10-14,4,22
632,2016-10-14 20:48:43+00:00,1,,787032409199882240,False,,,False,False,,1,MarkKennedyUND,Instagram,It was great to welcome @steveandrist and the North Dakota Newspaper Association to @myUND @ UND… https://t.co/2yDTtkOTM0,SteveAndrist; myUND,2016-10-14 20:48:43+00:00,2016-10-14,4,20
633,2016-10-14 20:23:00+00:00,9,,787025939716722692,False,,,False,False,,4,MarkKennedyUND,Instagram,Thanks to @myUND alum and @bwwings CEO Sally Smith for speaking to @undbusiness students.… https://t.co/sTo2Y26GZM,myUND; BWWings; UNDBusiness,2016-10-14 20:23:00+00:00,2016-10-14,4,20
634,2016-10-14 19:45:44+00:00,5,,787016557469704192,False,,,False,False,,2,MarkKennedyUND,Instagram,It was wonderful to spend time gaining insights from @undbusiness Advisory Council. @myUND… https://t.co/OLLTnROQEC,UNDBusiness; myUND,2016-10-14 19:45:44+00:00,2016-10-14,4,19
635,2016-10-14 19:42:15+00:00,1,,787015684605620226,False,,,False,False,,0,MarkKennedyUND,Instagram,Thanks to the @myUND und_cem Petroleum Engineering Advisory Council for their advice and… https://t.co/x5D6h1BTVQ,myUND,2016-10-14 19:42:15+00:00,2016-10-14,4,19
636,2016-10-14 16:50:46+00:00,1,,786972528937799681,False,,,False,False,,1,MarkKennedyUND,Instagram,"What a wonderful milestone, the ribbon cutting of @myUND's Collaborative Energy Complex for… https://t.co/t9nQLD8Lp9",myUND,2016-10-14 16:50:46+00:00,2016-10-14,4,16
637,2016-10-14 00:29:28+00:00,10,,786725576727941121,False,,,False,False,,1,MarkKennedyUND,Instagram,Thanks to Varsity Bards for performing during annual @myUND Sioux Awards. @ Alerus Center https://t.co/HIrsWhIYFK,myUND,2016-10-14 00:29:28+00:00,2016-10-14,4,0
638,2016-10-11 01:33:49+00:00,38,,785654605451362304,False,,,False,False,,10,MarkKennedyUND,Twitter Web Client,I am humbled to officially be @myUND's President - Kennedy inaugurated as UND's 12th president https://t.co/JC3SqRS3qZ,myUND,2016-10-11 01:33:49+00:00,2016-10-11,1,1
639,2016-10-10 15:37:41+00:00,11,,785504584668098560,False,,,False,False,,2,MarkKennedyUND,Twitter Web Client,Thanks to Matt Dunlevy &amp; @SkySkopes for inaugural air show! We are very proud of our @myUND alums at forefront in UAS! https://t.co/kTwc8RXsxS,SkySkopes; myUND,2016-10-10 15:37:41+00:00,2016-10-10,0,15
640,2016-10-10 12:34:27+00:00,0,,785458472003309568,False,7.853078434066063e+17,BiotechPatent,False,False,,0,MarkKennedyUND,Twitter Web Client,@BiotechPatent Steven is in town for my inauguration.,BiotechPatent,2016-10-10 12:34:27+00:00,2016-10-10,0,12
641,2016-10-10 01:53:25+00:00,2,,785297151580528640,False,,,False,False,,0,MarkKennedyUND,Instagram,Thanks to President Theodore Roosevelt for bringing greetings from the Rough Riders for my… https://t.co/F3LWTlQ7zg,,2016-10-10 01:53:25+00:00,2016-10-10,0,1
642,2016-10-09 02:15:07+00:00,6,,784940224639934464,False,,,False,False,,0,MarkKennedyUND,Instagram,What a joy to have my family join me for @undmhockey - go @myUND @ Ralph Engelstad Arena https://t.co/ofbzAwHHMu,UNDmhockey; myUND,2016-10-09 02:15:07+00:00,2016-10-09,6,2
643,2016-10-07 18:28:52+00:00,3,,784460498859286532,False,,,False,False,,1,MarkKennedyUND,Twitter Web Client,Thanks for letting me profile one of my heroes. Go @myUND https://t.co/zcJ4ft03Z1,myUND,2016-10-07 18:28:52+00:00,2016-10-07,4,18
644,2016-10-07 14:37:18+00:00,3,,784402224839405581,False,,,False,False,,3,MarkKennedyUND,Twitter Web Client,"Recent survey by @PewResearch shows fast growing jobs require liberal arts based education @MyUND provides.
https://t.co/wXlWzLc9MQ",pewresearch; myUND,2016-10-07 14:37:18+00:00,2016-10-07,4,14
645,2016-10-07 02:56:04+00:00,1,,784225753244106752,False,,,False,False,,0,MarkKennedyUND,Instagram,It was wonderful to learn more about @myUND's innovative Humanities and Integrated Studies… https://t.co/o9tp1GzHRX,myUND,2016-10-07 02:56:04+00:00,2016-10-07,4,2
646,2016-10-06 17:06:46+00:00,1,UNDGREENDOT,784077451106279424,False,,,False,False,,0,MarkKennedyUND,Instagram,Everyone should be an active bystander and learn about the #UNDGREENDOT program. Go Green! @… https://t.co/lljvMdHlLi,,2016-10-06 17:06:46+00:00,2016-10-06,3,17
647,2016-10-06 02:07:31+00:00,13,,783851149229076480,False,,,False,False,,1,MarkKennedyUND,Twitter Web Client,Congrats to @myUND as the 11th healthiest campus in the nation! Celebrate by having another carrot - https://t.co/HWmWvERyQk via @Greatist,myUND; greatist,2016-10-06 02:07:31+00:00,2016-10-06,3,2
648,2016-10-05 21:22:30+00:00,19,,783779422365102080,False,,,False,False,,8,MarkKennedyUND,Instagram,I am looking forward to a great season for @myUND's undmbasketball @ Betty Engelstad Sioux Center https://t.co/BxHOuvLbnu,myUND,2016-10-05 21:22:30+00:00,2016-10-05,2,21
649,2016-10-04 12:20:11+00:00,2,,783280554477137921,False,,,False,False,,0,MarkKennedyUND,Twitter Web Client,It was wonderful to experience the hands-on training @UNDCNPD provides students. https://t.co/6OTNUd0yfM,UNDCNPD,2016-10-04 12:20:11+00:00,2016-10-04,1,12
650,2016-10-04 05:25:45+00:00,3,,783176260939677697,False,,,False,False,,0,MarkKennedyUND,Twitter Web Client,"Thanks Marilyn for welcoming the wind beneath my wings! - HAGERTY: Welcome to @MyUnd, first lady Debbie Kennedy - https://t.co/IYDTfhztXd",myUND,2016-10-04 05:25:45+00:00,2016-10-04,1,5
651,2016-10-03 22:50:43+00:00,1,,783076845897998336,False,,,False,False,,0,MarkKennedyUND,Instagram,The sky is the limit for @myUND with our Atmospheric Sciences department of undaerospace… https://t.co/HUU7Q0x38f,myUND,2016-10-03 22:50:43+00:00,2016-10-03,0,22
652,2016-10-03 22:44:45+00:00,3,,783075343057903617,False,,,False,False,,0,MarkKennedyUND,Instagram,"Every time I tour undaerospace, I am more impressed. With our new Robin Hall,   @myUND's… https://t.co/nO9L969Uoy",myUND,2016-10-03 22:44:45+00:00,2016-10-03,0,22
653,2016-10-03 20:18:46+00:00,0,FCS,783038606596124672,True,,,Mon Oct 03 17:06:34 +0000 2016,FCS_STATS,Twitter Web Client,74,MarkKennedyUND,Twitter Web Client,Top seven are unchanged in #FCS Top 25. https://t.co/Mzn9tt0IqT,FCS_STATS,2016-10-03 20:18:46+00:00,2016-10-03,0,20
654,2016-10-02 03:16:12+00:00,71,,782418880568238081,False,,,False,False,,18,MarkKennedyUND,Twitter Web Client,Count them - 8 National @UNDmhockey Championships. There is a reason they call it the @NDChampionsClub at @myUND - Great flag raising event. https://t.co/peJV8MUnby,UNDmhockey; NDChampionsClub; myUND,2016-10-02 03:16:12+00:00,2016-10-02,6,3
655,2016-10-01 22:08:55+00:00,1,,782341548973264896,False,,,False,False,,0,MarkKennedyUND,Twitter Web Client,Multiforce team getting ready 2 throw @USArmy footballs at @myUND @UNDfootball 31-24 victory vs @CalPoly. Big win 4 team &amp; @BubbaSchweigert https://t.co/7I25dH64Gn,USArmy; myUND; UNDfootball; CalPoly; BubbaSchweigert,2016-10-01 22:08:55+00:00,2016-10-01,5,22
656,2016-09-30 18:41:59+00:00,1,,781927087024201728,False,,,False,False,,0,MarkKennedyUND,Twitter Web Client,Thanks for the invite! https://t.co/vOKYL4yBoX,,2016-09-30 18:41:59+00:00,2016-09-30,4,18
657,2016-09-30 18:37:27+00:00,42,,781925943904391168,False,,,False,False,,14,MarkKennedyUND,Twitter Web Client,"Congrats to teams, schools, State of ND &amp; @NDGovDalrymple on 2 championships in 1 year. As we raise the flag for ours @MyUND looks for more! https://t.co/kGv0jOGquc",myUND,2016-09-30 18:37:27+00:00,2016-09-30,4,18
658,2016-09-30 01:04:55+00:00,3,,781661066900086784,False,,,False,False,,2,MarkKennedyUND,Instagram,Thanks to @undeerc for including @debbiekennedy10 and me in their Oktoberfest Celebration.… https://t.co/ZGuwYfc5IJ,undeerc; DebbieKennedy10,2016-09-30 01:04:55+00:00,2016-09-30,4,1
659,2016-09-28 12:38:54+00:00,2,,781110936551555072,False,,,False,False,,1,MarkKennedyUND,Twitter Web Client,Wisdom for all from Emily Gibben in @myUND student paper - Social media: the new permanent record https://t.co/XxTEjySxfM,myUND,2016-09-28 12:38:54+00:00,2016-09-28,2,12
660,2016-09-28 02:02:34+00:00,3,Grilling,780950799920746496,False,,,False,False,,1,MarkKennedyUND,Instagram,Great group for 6th #Grilling&amp;Chilling at @myUND @ University of North Dakota https://t.co/55J1ebhjuL,myUND,2016-09-28 02:02:34+00:00,2016-09-28,2,2
661,2016-09-28 01:57:32+00:00,2,,780949532276252672,False,,,False,False,,0,MarkKennedyUND,Twitter Web Client,Toured @MYUND College of Nursing &amp; Professional Disciplines - RAIN Program is source of 8 in 10 American Indian Registered Nurses in ND https://t.co/wXN4eka808,myUND,2016-09-28 01:57:32+00:00,2016-09-28,2,1
662,2016-09-25 20:50:05+00:00,2,grandkidsrock,780147385926291456,False,,,False,False,,0,MarkKennedyUND,Instagram,"Four generations of Kennedy's - Alvina, Mariana and pkennedy109. #grandkidsrock @ City of… https://t.co/etUCCIvdE2",,2016-09-25 20:50:05+00:00,2016-09-25,6,20
663,2016-09-24 23:36:16+00:00,23,,779826818408968193,False,,,False,False,,1,MarkKennedyUND,Instagram,Thank you for big win for @undfootball with bigskyconf opener. Go @myUND @ Montana State University https://t.co/uPUl3kwtqZ,UNDfootball; myUND,2016-09-24 23:36:16+00:00,2016-09-24,5,23
664,2016-09-24 23:22:35+00:00,5,,779823374197481472,False,,,False,False,,0,MarkKennedyUND,Instagram,"Touchdown Oliveira!  montanastateuniversity answers, but misses 2 point.  @undfootball up 17-15.… https://t.co/9YOcQqQcG5",UNDfootball,2016-09-24 23:22:35+00:00,2016-09-24,5,23
665,2016-09-24 22:21:48+00:00,1,,779808077042311168,False,,,False,False,,0,MarkKennedyUND,Instagram,Kickoff after field goal. @undfootball up again 10-9 in bigskyconf opener against… https://t.co/o6OETGlUpK,UNDfootball,2016-09-24 22:21:48+00:00,2016-09-24,5,22
666,2016-09-24 21:25:18+00:00,10,leavenodoubt,779793857068277760,False,,,False,False,,1,MarkKennedyUND,Instagram,Touchdown @undfootball - go Hawks. @siouxfan @myUND #leavenodoubt @ Montana State University https://t.co/Vo8wQkLIAh,UNDfootball; siouxfan; myUND,2016-09-24 21:25:18+00:00,2016-09-24,5,21
667,2016-09-24 00:01:11+00:00,3,,779470698834255872,False,,,False,False,,0,MarkKennedyUND,Instagram,It was an honor to attend on behalf of @myUND the inaugural of Dr. Thomas M. Mitzel as President… https://t.co/IMQOZRH4Z8,myUND,2016-09-24 00:01:11+00:00,2016-09-24,5,0
668,2016-09-23 21:41:40+00:00,1,coffeewithkennedy,779435591352119296,False,,,False,False,,0,MarkKennedyUND,Instagram,"Thanks to @myUND alums, including Rep. Alan Fehr, for joining my #coffeewithkennedy in… https://t.co/WYoZnjgW5l",myUND,2016-09-23 21:41:40+00:00,2016-09-23,4,21
669,2016-09-22 22:26:12+00:00,0,,779084407906770944,True,,,Thu Sep 22 21:47:53 +0000 2016,UofNorthDakota,Hootsuite,2,MarkKennedyUND,Twitter for iPhone,The latest update on the recently discovered Snapchat photos can be found at: https://t.co/7YeCaSdHRX,myUND,2016-09-22 22:26:12+00:00,2016-09-22,3,22
670,2016-09-22 18:45:19+00:00,2,coffeewithkennedy,779028823996260353,False,,,False,False,,0,MarkKennedyUND,Instagram,What a warm welcome in Watford City on my #coffeewithkennedy tour for @myUND @ StoneHome Brewing… https://t.co/L7xAqViX7W,myUND,2016-09-22 18:45:19+00:00,2016-09-22,3,18
671,2016-09-22 16:30:37+00:00,2,coffeewithkennedy,778994923177648128,False,,,False,False,,1,MarkKennedyUND,Instagram,Thanks To @khumps11 Acting President John Miller for tour on my #coffeewithkennedy tour for… https://t.co/I0A0yHUEOO,,2016-09-22 16:30:37+00:00,2016-09-22,3,16
672,2016-09-21 21:25:40+00:00,1,coffeewithkennedy,778706789558657024,False,,,False,False,,0,MarkKennedyUND,Instagram,I enjoyed meeting with a great group of Bismarck high school seniors on my #coffeewithkennedy… https://t.co/wPGMV6xvmr,,2016-09-21 21:25:40+00:00,2016-09-21,2,21
673,2016-09-21 19:24:48+00:00,0,,778676372134727680,True,,,Wed Sep 21 16:55:44 +0000 2016,UofNorthDakota,Instagram,13,MarkKennedyUND,Twitter Web Client,You likely are aware of an incident in which a photo of three individuals and an abhorrent… https://t.co/ZuwOpZNFOE,myUND,2016-09-21 19:24:48+00:00,2016-09-21,2,19
674,2016-09-21 19:22:38+00:00,2,,778675825440874497,False,,,False,False,,0,MarkKennedyUND,Instagram,It was great to learn about Nueta Hidatsa Sahnish College from @myUND alum and their President… https://t.co/epcK4dEJ4c,myUND,2016-09-21 19:22:38+00:00,2016-09-21,2,19
675,2016-09-21 03:10:49+00:00,2,,778431260041605120,False,,,False,False,,1,MarkKennedyUND,Twitter Web Client,I see a bright future as One UND! - president asks campus to put past conflicts behind them https://t.co/QYjWTwieVd,,2016-09-21 03:10:49+00:00,2016-09-21,2,3
676,2016-09-20 19:59:20+00:00,4,,778322672404967424,False,,,False,False,,0,MarkKennedyUND,Instagram,Don't let northdakota_state buffalo you. The biggest bison is in Jamestown. @myUND… https://t.co/CGurwvXrGV,myUND,2016-09-20 19:59:20+00:00,2016-09-20,1,19
677,2016-09-20 17:11:15+00:00,1,coffeewithkennedy,778280375390986240,False,,,False,False,,0,MarkKennedyUND,Instagram,Stopped by Hunter Cafe again to get Deb Tarvestad's pie. Heading West for #coffeewithkennedy… https://t.co/PdNZ6hdmtt,,2016-09-20 17:11:15+00:00,2016-09-20,1,17
678,2016-09-20 01:34:16+00:00,2,,778044574639857664,False,,,False,False,,0,MarkKennedyUND,Twitter for iPhone,It was wonderful to learn more about the great work of @myUND Office of Extended Learning. https://t.co/ckzOuwkT4e,myUND,2016-09-20 01:34:16+00:00,2016-09-20,1,1
679,2016-09-20 01:29:29+00:00,4,,778043369071190016,False,,,False,False,,1,MarkKennedyUND,Instagram,It is great to hear our student athletes share their stories with those who support scholarships… https://t.co/P4jGES9DcD,,2016-09-20 01:29:29+00:00,2016-09-20,1,1
680,2016-09-18 00:37:25+00:00,15,,777305490451795968,False,,,False,False,,4,MarkKennedyUND,Instagram,Those who left early missed a great @undfootball win. I am 1-0 in aleruscenter as a @myUND fan.… https://t.co/bnuXv6aNTo,UNDfootball; myUND,2016-09-18 00:37:25+00:00,2016-09-18,6,0
681,2016-09-17 16:44:50+00:00,1,PotatoBowl,777186561628729345,False,,,False,False,,0,MarkKennedyUND,Instagram,The @myUND Pride of the North Marching Band gave a great performance in the #PotatoBowl parade.… https://t.co/xLW73P4yhw,myUND,2016-09-17 16:44:50+00:00,2016-09-17,5,16
682,2016-09-17 16:38:42+00:00,1,PotatoBowl,777185016740798465,False,,,False,False,,0,MarkKennedyUND,Instagram,Thanks to @myUND Cheer  Team for being in the #PotatoBowl parade.  On to victory for… https://t.co/veJ5rkS9bt,myUND,2016-09-17 16:38:42+00:00,2016-09-17,5,16
683,2016-09-17 15:17:07+00:00,7,,777164487237468160,False,,,False,False,,1,MarkKennedyUND,Instagram,"Great to join Potato Bowl Grand Marshall tomscottcampbell, dominik_olownia, Levi, nate.ziegler,… https://t.co/nXtPkvzYsj",,2016-09-17 15:17:07+00:00,2016-09-17,5,15
684,2016-09-17 00:13:14+00:00,1,,776937017615773696,False,,,False,False,,0,MarkKennedyUND,Instagram,Thanks to @myUND music department for the great concert. @ Hughes Fine Arts Center https://t.co/45wzcfUpF7,myUND,2016-09-17 00:13:14+00:00,2016-09-17,5,0
685,2016-09-16 12:28:04+00:00,7,UNDGFBetterTogether,776759555296374784,False,,,False,False,,6,MarkKennedyUND,Twitter Web Client,TY Mayor Brown &amp; @GrandForksCity for support of @MyUND #UNDGFBetterTogether-America's best college town supports UND https://t.co/zZM58ClRmx,GrandForksCity; myUND,2016-09-16 12:28:04+00:00,2016-09-16,4,12
686,2016-09-16 01:46:38+00:00,15,PotatoBowl,776598134545846272,False,,,False,False,,4,MarkKennedyUND,Instagram,Let the #PotatoBowl festivities for @myUND begin.  Go @undfootball @ University of North Dakota https://t.co/8B5Xr1UhRw,myUND; UNDfootball,2016-09-16 01:46:38+00:00,2016-09-16,4,1
687,2016-09-14 00:53:27+00:00,8,,775859974492663808,False,,,False,False,,3,MarkKennedyUND,Twitter Web Client,Thanks to @EndeavorAir for engaging @myUND students from @UNDAerospace https://t.co/FiSPVzv6R8,EndeavorAir; myUND; UNDAerospace,2016-09-14 00:53:27+00:00,2016-09-14,2,0
688,2016-09-13 23:03:46+00:00,0,myUND; flyUND,775832371815849984,True,,,Tue Sep 13 20:32:42 +0000 2016,UNDAerospace,Twitter Web Client,1,MarkKennedyUND,Twitter Web Client,Looking good in the left seat @MarkKennedyUND flying the CRJ simulator on his tour this afternoon. #myUND #flyUND https://t.co/kQQJ8pAx3b,UNDAerospace; MarkKennedyUND,2016-09-13 23:03:46+00:00,2016-09-13,1,23
689,2016-09-13 23:03:41+00:00,0,flyUND; myUND,775832351032999936,True,,,Tue Sep 13 20:41:05 +0000 2016,UNDAerospace,Twitter Web Client,2,MarkKennedyUND,Twitter Web Client,@MarkKennedyUND clearing an F-18 to land in the 360 degree ATC tower simulator @myUND. #flyUND #myUND https://t.co/0NUEWU9MhM,UNDAerospace; MarkKennedyUND; myUND,2016-09-13 23:03:41+00:00,2016-09-13,1,23
690,2016-09-13 23:00:38+00:00,3,,775831582779244544,False,,,False,False,,0,MarkKennedyUND,Instagram,Part of the team at undaerospace that earns undaviation the best safety record in aviation… https://t.co/W43apaYbUQ,,2016-09-13 23:00:38+00:00,2016-09-13,1,23
691,2016-09-13 19:22:03+00:00,2,,775776577451855874,False,,,False,False,,0,MarkKennedyUND,Instagram,Wonderful to see @myUND space suit lab with Prof. Pablo De Leon and team. @ John D. Odegard… https://t.co/lvHt76wVSz,myUND,2016-09-13 19:22:03+00:00,2016-09-13,1,19
692,2016-09-13 16:52:34+00:00,1,,775738957233524736,False,,,False,False,,0,MarkKennedyUND,Instagram,"Enjoyed serving tacos in a bag for @myUND Recognition Week with Sol Jensen, rachelosowski, and… https://t.co/XiOkgcJsrh",myUND,2016-09-13 16:52:34+00:00,2016-09-13,1,16
693,2016-09-13 01:33:23+00:00,13,,775507636515180544,False,,,False,False,,3,MarkKennedyUND,Instagram,Thanks to @myUND alum Chris Wolf from Alerus and Jon Bonzer from @bonzerspub for a great meal. @… https://t.co/DrXFKwhACx,myUND; BonzersPub,2016-09-13 01:33:23+00:00,2016-09-13,1,1
694,2016-09-12 12:21:15+00:00,5,,775308290762747904,False,,,False,False,,5,MarkKennedyUND,Twitter Web Client,Building bench@MyUND to make Red River- Silicon Valley of Drones- New UND class puts focus on the business of drones https://t.co/QxxW8ZCeRi,,2016-09-12 12:21:15+00:00,2016-09-12,0,12
695,2016-09-11 02:43:34+00:00,1,,774800522981306368,False,,,False,False,,0,MarkKennedyUND,Instagram,"At altruhealthsystem gala auction, @undmhockey jersey goes for $8,900 and dinner with… https://t.co/rgUOG1iON1",UNDmhockey,2016-09-11 02:43:34+00:00,2016-09-11,6,2
696,2016-09-10 19:35:45+00:00,5,,774692859899420673,False,,,False,False,,0,MarkKennedyUND,Instagram,I greatly appreciate my father joining me for a week at @myUND and sharing his experiences of… https://t.co/GRUSUdW1R1,myUND,2016-09-10 19:35:45+00:00,2016-09-10,5,19
697,2016-09-10 14:24:49+00:00,1,,774614609785294848,False,,,False,False,,1,MarkKennedyUND,Twitter Web Client,UND PRESIDENT: How UND can ride the 'digitization wave' https://t.co/ccU2KwmFPk  @myUND,myUND,2016-09-10 14:24:49+00:00,2016-09-10,5,14
698,2016-09-09 00:56:05+00:00,14,,774048700544921600,False,,,False,False,,1,MarkKennedyUND,Twitter Web Client,We very much enjoyed our meal. The Red Pepper is a pillar of the @myUND community! https://t.co/0KO7eEuAgt,myUND,2016-09-09 00:56:05+00:00,2016-09-09,4,0
699,2016-09-08 21:47:06+00:00,1,,774001137909272577,False,7.739903208663286e+17,scotthennen,False,False,,0,MarkKennedyUND,Twitter for iPhone,"@scotthennen I had an oatmeal, chocolate chip cookie. Delicious. My father Eugene counted 20 cookie options.",scotthennen,2016-09-08 21:47:06+00:00,2016-09-08,3,21
700,2016-09-08 21:03:00+00:00,0,coffeewithkennedy,773990042197000193,False,,,False,False,,0,MarkKennedyUND,Instagram,What a wonderful warm welcome at Kerry's Kitchen in Casselton on #coffeewithkennedy tour with… https://t.co/dhpTAuYRJ1,,2016-09-08 21:03:00+00:00,2016-09-08,3,21
701,2016-09-08 20:59:03+00:00,1,,773989049149300736,False,,,False,False,,0,MarkKennedyUND,Instagram,It was great to speak to Central Cass High students about how best to plan for a successful… https://t.co/og9biEm0vP,,2016-09-08 20:59:03+00:00,2016-09-08,3,20
702,2016-09-08 17:22:04+00:00,4,,773934442406707200,False,,,False,False,,1,MarkKennedyUND,Instagram,Wonderful pie and great banners at Hunter Cafe with Deb Tarvestad and father Eugene during… https://t.co/CHdngEF46q,,2016-09-08 17:22:04+00:00,2016-09-08,3,17
703,2016-09-08 17:20:08+00:00,4,,773933953300520960,False,,,False,False,,2,MarkKennedyUND,Instagram,My father Eugene swapping stories of the good old days in Hunter with UND alum Randy Moen in… https://t.co/qaEUHuxjZT,,2016-09-08 17:20:08+00:00,2016-09-08,3,17
704,2016-09-08 17:17:32+00:00,3,,773933300528414721,False,,,False,False,,1,MarkKennedyUND,Instagram,Visiting Dakota Heritage Bank where my father Eugene worked from 1953-54 in Hunter ND on… https://t.co/NmEVaMFbpx,,2016-09-08 17:17:32+00:00,2016-09-08,3,17
705,2016-09-08 16:14:48+00:00,7,,773917512857780224,False,,,False,False,,1,MarkKennedyUND,Instagram,"A trip down memory lane with my father Eugene at St. Agnes Catholic Church in Hunter, ND, where… https://t.co/WAPan4rTxL",,2016-09-08 16:14:48+00:00,2016-09-08,3,16
706,2016-09-08 15:59:41+00:00,1,mayvillestate,773913710624735233,False,,,False,False,,0,MarkKennedyUND,Instagram,"Gary Hagen, President of #mayvillestate, and I visiting Strategies in Reading class taught by… https://t.co/VC8sPfbetX",,2016-09-08 15:59:41+00:00,2016-09-08,3,15
707,2016-09-07 18:05:38+00:00,5,,773583017424060416,False,,,False,False,,1,MarkKennedyUND,Instagram,"Home grown potatoes from Fred and Greg Cook during our @myUND stop in Edinburg, ND. @UND_Alumni… https://t.co/SXOjGgHBn9",myUND,2016-09-07 18:05:38+00:00,2016-09-07,2,18
708,2016-09-07 17:54:33+00:00,4,,773580227335380992,False,,,False,False,,2,MarkKennedyUND,Instagram,Wonderful welcome lunch at Edinburg with some great @myUND  alums. @UND_Alumni @ FIRESIDE LOUNGE https://t.co/tuzPkjZlnj,myUND,2016-09-07 17:54:33+00:00,2016-09-07,2,17
709,2016-09-07 17:05:58+00:00,2,,773568000087691265,False,,,False,False,,0,MarkKennedyUND,Instagram,"What a treat to visit Edinburg General Store with Bernice Flanagan, @debbiekennedy10, father… https://t.co/QG79aNzogm",DebbieKennedy10,2016-09-07 17:05:58+00:00,2016-09-07,2,17
710,2016-09-07 14:26:29+00:00,3,,773527868651532288,False,,,False,False,,0,MarkKennedyUND,Instagram,Thanks to Grafton Chamber of Commerce for hosting a Coffee with Kennedy to discuss @myUND with… https://t.co/zGqR35TJwz,myUND,2016-09-07 14:26:29+00:00,2016-09-07,2,14
711,2016-09-06 20:14:16+00:00,8,,773253000278188033,False,,,False,False,,0,MarkKennedyUND,Instagram,Thanks to my father Eugene for joining me as a guest speaker in Prof. Ferraro's class on aging.… https://t.co/mHtfOoAieY,,2016-09-06 20:14:16+00:00,2016-09-06,1,20
712,2016-09-06 01:20:25+00:00,4,,772967658501251072,False,,,False,False,,2,MarkKennedyUND,Twitter Web Client,Please join me for coffee if you live near one of my stops as I tour Eastern North Dakota his week. https://t.co/m5TTE2TqDQ,,2016-09-06 01:20:25+00:00,2016-09-06,1,1
713,2016-09-04 12:28:46+00:00,9,,772411077514506240,False,,,False,False,,5,MarkKennedyUND,Twitter Web Client,Our thoughts and prayers are with the Wetterling family today. https://t.co/3fF8j6Rv4D,,2016-09-04 12:28:46+00:00,2016-09-04,6,12
714,2016-09-02 23:38:52+00:00,7,,771854940209815556,False,,,False,False,,0,MarkKennedyUND,Instagram,"What a joy to welcome another MRK - Mariana Rose Kennedy, daughter of our son pkennedy109 and… https://t.co/VFcj6Vy9GH",,2016-09-02 23:38:52+00:00,2016-09-02,4,23
715,2016-09-01 22:57:10+00:00,5,,771482057776267264,False,,,False,False,,0,MarkKennedyUND,Instagram,Jim &amp; Amy ALEXANDER among the many @myUND here to cheer the @undfootball team on to victory over… https://t.co/STl0CjJF8i,myUND; UNDfootball,2016-09-01 22:57:10+00:00,2016-09-01,3,22
716,2016-09-01 14:51:10+00:00,1,,771359750592364544,False,,,False,False,,0,MarkKennedyUND,Twitter Web Client,It was wonderful to introduce new @myUND  faculty and staff to the great state of North Dakota. https://t.co/HugGOmN2vQ,myUND,2016-09-01 14:51:10+00:00,2016-09-01,3,14
